{
  "schemaVersion": 1,
  "gateId": "toolchain-ci",
  "status": "pass",
  "designCommit": "5893d4340a4815677da79f74223642ac855519e7",
  "testedCommit": "323538ca9b0e33173b67778310657966196b0dc5",
  "testedAt": "2026-07-15T14:11:33.226Z",
  "scopeFiles": [
    ".github/workflows/platform-smoke.yml",
    ".github/workflows/quality.yml",
    "docs/feasibility/evidence-scopes.json",
    "docs/feasibility/evidence.schema.json",
    "package.json",
    "pnpm-lock.yaml",
    "scripts/feasibility-evidence.mjs",
    "scripts/feasibility-evidence.test.mjs",
    "scripts/verify-ci.mjs"
  ],
  "scopeSha256": "1274352814732d1e94c76c55a22362957d0959e06e66998f8fba6fe2c3f0bd64",
  "markdownPath": "docs/feasibility/toolchain-ci.md",
  "markdownSha256": "7ff3ce43940d68a078016f3bca096aac227617226733d343b27e37316ab3ca71",
  "decisions": [],
  "platforms": [
    {
      "id": "windows-x64",
      "osVersion": "Microsoft Windows Server 2025, 10.0.26100 Datacenter; runner 2.335.1; image windows-2025-vs2026 20260714.173.1",
      "arch": "x86_64",
      "command": "pnpm install --frozen-lockfile && pnpm build && cargo test --manifest-path src-tauri/Cargo.toml --all-targets && pnpm tauri build --debug --no-bundle --target x86_64-pc-windows-msvc",
      "exitCode": 0,
      "runUrl": "https://github.com/xiaobing6/yinmi-desktop/actions/runs/29421799009/job/87373863351"
    },
    {
      "id": "macos-intel",
      "osVersion": "macOS 15.7.7 (24G720); runner 2.335.1; image macos-15 20260629.0276.1",
      "arch": "x86_64",
      "command": "pnpm install --frozen-lockfile && pnpm build && cargo test --manifest-path src-tauri/Cargo.toml --all-targets && cargo check --manifest-path src-tauri/Cargo.toml --target x86_64-apple-darwin && pnpm tauri build --debug --no-bundle --target x86_64-apple-darwin",
      "exitCode": 0,
      "runUrl": "https://github.com/xiaobing6/yinmi-desktop/actions/runs/29421799009/job/87373863412"
    },
    {
      "id": "macos-arm64",
      "osVersion": "macOS 15.7.7 (24G720); runner 2.335.1; image macos-15-arm64 20260706.0213.1",
      "arch": "aarch64",
      "command": "pnpm install --frozen-lockfile && pnpm build && cargo test --manifest-path src-tauri/Cargo.toml --all-targets && cargo check --manifest-path src-tauri/Cargo.toml --target aarch64-apple-darwin && cargo check --manifest-path src-tauri/Cargo.toml --target x86_64-apple-darwin && pnpm tauri build --debug --no-bundle --target universal-apple-darwin && lipo -archs src-tauri/target/universal-apple-darwin/debug/yinmi",
      "exitCode": 0,
      "runUrl": "https://github.com/xiaobing6/yinmi-desktop/actions/runs/29421799009/job/87373863321"
    }
  ],
  "checks": {
    "event": "push",
    "headSha": "323538ca9b0e33173b67778310657966196b0dc5",
    "quality": {
      "conclusion": "success",
      "headSha": "323538ca9b0e33173b67778310657966196b0dc5",
      "runUrl": "https://github.com/xiaobing6/yinmi-desktop/actions/runs/29421799110/job/87373863329"
    },
    "platform-windows": {
      "conclusion": "success",
      "headSha": "323538ca9b0e33173b67778310657966196b0dc5",
      "runUrl": "https://github.com/xiaobing6/yinmi-desktop/actions/runs/29421799009/job/87373863351"
    },
    "platform-macos": {
      "conclusion": "success",
      "headSha": "323538ca9b0e33173b67778310657966196b0dc5",
      "runUrl": "https://github.com/xiaobing6/yinmi-desktop/actions/runs/29421799009/job/87376084020"
    }
  }
}
